{
  "registryVersion": 2,
  "specId": "SPEC-0001",
  "authorizationId": "phase-1.5-compatibility-synthetic/v1",
  "operationFamilies": ["checkpoint", "fixture", "pointer", "protected-regression", "runner-environment", "screenshot", "visible-role", "visible-testid", "workspace-driver"],
  "adapter": {
    "path": "scripts/spec0001-browser/actions/phase15CompatibilitySynthetic.ts",
    "byteLength": 1302,
    "sha256": "sha256:075ebbd1d29e701d4cb40073c2924acce3bb50bbafc32d18a0dbe5ea346329f3"
  },
  "fixtures": [
    {"fixtureId": "synthetic-environment-plan", "fixtureKind": "stick-browser-environment-plan-v1", "sourceKind": "adapter-built-in", "expectedFixtureDigest": "sha256:9736d7bc6612adf2474772037c4ff02352fce6b2f0cd708f9f47ef9449d8fba3"},
    {"fixtureId": "synthetic-gate-release", "fixtureKind": "stick-browser-environment-gate-release-v1", "sourceKind": "adapter-built-in", "expectedFixtureDigest": "sha256:49080f0adeaf24ae4e32cab32b7173e6ad29f0066530a894fda237529b35b595"},
    {"fixtureId": "synthetic-joint-edit", "fixtureKind": "stick-completed-joint-edit-v1", "sourceKind": "adapter-built-in", "expectedFixtureDigest": "sha256:62946809dfb4bd8f7e4fead629e994ef4870d78d70087409954a3d59d5e9bbd1"},
    {"fixtureId": "synthetic-publication-completion", "fixtureKind": "stick-document-publication-completion-v1", "sourceKind": "adapter-built-in", "expectedFixtureDigest": "sha256:8a679641bb30e17a4fbc7ec2937fbf4f58d0ec1862c4b9304947a6fa2c1dee3d"},
    {"fixtureId": "synthetic-publication-plan", "fixtureKind": "stick-document-publication-plan-v1", "sourceKind": "adapter-built-in", "expectedFixtureDigest": "sha256:ca2c0458c54ef6fd88ffa34bd203dc721e0f6f2594420381b5a4b2c91693c36f"},
    {"fixtureId": "synthetic-wave-document", "fixtureKind": "stick-workspace-document-mount-v1", "sourceKind": "adapter-built-in", "expectedFixtureDigest": "sha256:b412a05aca94327c04b0cfd4945469b4d8f8c5b5b3385139b680ac3491795475"}
  ],
  "actions": [
    {"actionId": "environment-install", "family": "runner-environment", "operation": "installEnvironmentPlan", "fixtureId": "synthetic-environment-plan", "operationId": "environment-install", "expectedEvidenceDigest": "sha256:c3a9008b070eb1f941fbc42c64717aa8dd69c9c274f273504c3c603e2b88a05d"},
    {"actionId": "fixture-mount", "family": "workspace-driver", "operation": "mountDocument", "fixtureId": "synthetic-wave-document", "operationId": "fixture-mount", "expectedEvidenceDigest": "sha256:7b85517231a0986f03440b87cf1641565cc41f86d3857800bd62390a753d48cd"},
    {"actionId": "checkpoint-after-mount", "family": "checkpoint", "channel": "workspace-driver", "checkpointId": "after-mount", "expectedEvidenceDigest": "sha256:bd31ca43190101039aab0b0e401ce0d70fbf898972effd70d8d69c1dd65bf7cf"},
    {"actionId": "manual-ready-position", "family": "workspace-driver", "operation": "dispatchCompletedJointEdit", "fixtureId": "synthetic-joint-edit", "operationId": "manual-ready-position", "expectedEvidenceDigest": "sha256:57d31678002650c85c71837f093638c4bea791cf3808fc370e42e447cce257b3"},
    {"actionId": "manual-inward-pose", "family": "workspace-driver", "operation": "dispatchCompletedJointEdit", "fixtureId": "synthetic-joint-edit", "operationId": "manual-inward-pose", "expectedEvidenceDigest": "sha256:16dac8105156f851a5273120aa61d68bc58986149afb0792ca4baab807a0ad4a"},
    {"actionId": "manual-outward-pose", "family": "workspace-driver", "operation": "dispatchCompletedJointEdit", "fixtureId": "synthetic-joint-edit", "operationId": "manual-outward-pose", "expectedEvidenceDigest": "sha256:7ba0ffb79f2f22c3ea28ebe86956808b81222cfb2d08b5bdf1b81691a5e98b4d"},
    {"actionId": "drag-down", "family": "pointer", "operation": "down", "targetId": "synthetic-stick-canvas", "pointerId": 1, "button": 0, "point": {"x": 320, "y": 240}, "expectedEvidenceDigest": "sha256:635776f91d5983273c24c53193eb912fb439a387ae5cabed4bdbc242599af239"},
    {"actionId": "drag-move", "family": "pointer", "operation": "move", "targetId": "synthetic-stick-canvas", "pointerId": 1, "button": 0, "point": {"x": 360, "y": 210}, "expectedEvidenceDigest": "sha256:c84f622eb950f819202a1d9ce45fbf4d4b375b9b72dc7457586e12f5361d8d07"},
    {"actionId": "drag-up", "family": "pointer", "operation": "up", "targetId": "synthetic-stick-canvas", "pointerId": 1, "button": 0, "point": {"x": 360, "y": 210}, "expectedEvidenceDigest": "sha256:46f6ed939325fe25192035ea0f39d4c714cf3f55a200378a87e52bf1b99b7232"},
    {"actionId": "cancel-down", "family": "pointer", "operation": "down", "targetId": "synthetic-stick-canvas", "pointerId": 2, "button": 0, "point": {"x": 400, "y": 260}, "expectedEvidenceDigest": "sha256:b617c964a467d557bac0701c76091551aa28cb1d2158004c8750ab30b0362a6b"},
    {"actionId": "cancel-move", "family": "pointer", "operation": "move", "targetId": "synthetic-stick-canvas", "pointerId": 2, "button": 0, "point": {"x": 430, "y": 280}, "expectedEvidenceDigest": "sha256:659cf2be0dc2826e99a1da6069d25c7818cab8c006bcf861a9a9257fb885dd14"},
    {"actionId": "cancel-terminal", "family": "pointer", "operation": "cancel", "targetId": "synthetic-stick-canvas", "pointerId": 2, "button": 0, "point": {"x": 430, "y": 280}, "expectedEvidenceDigest": "sha256:e34235ef783f022943b0d60863aec8402dc204d3a6f79efea107f2e60616a27d"},
    {"actionId": "publication-begin-a", "family": "workspace-driver", "operation": "beginDocumentPublication", "fixtureId": "synthetic-publication-plan", "operationId": "publication-a", "expectedEvidenceDigest": "sha256:dfffe45c01172566876e8322d0585253a8880b39141132274d6c1e936ca0724f"},
    {"actionId": "publication-begin-b", "family": "workspace-driver", "operation": "beginDocumentPublication", "fixtureId": "synthetic-publication-plan", "operationId": "publication-b", "expectedEvidenceDigest": "sha256:98b22e55dc18a9e63abb58d21a8941e9abb6db074c3c990aac539c8b85bd8fb7"},
    {"actionId": "publication-complete-b", "family": "workspace-driver", "operation": "completeDocumentPublication", "fixtureId": "synthetic-publication-completion", "operationId": "publication-b", "expectedEvidenceDigest": "sha256:221483a20eef9d932c9f3932aeae8ce7a44c2412cefea7dbfee6e64f95b6c558"},
    {"actionId": "publication-complete-a", "family": "workspace-driver", "operation": "completeDocumentPublication", "fixtureId": "synthetic-publication-completion", "operationId": "publication-a", "expectedEvidenceDigest": "sha256:4433a00355812500112cbb638c00285503b2ffd4d66e70e80ea27410a7babf80"},
    {"actionId": "environment-release", "family": "runner-environment", "operation": "releaseEnvironmentGate", "fixtureId": "synthetic-gate-release", "operationId": "environment-release", "expectedEvidenceDigest": "sha256:db12099dc29b366ba2f9834f0a0f1f4a97e109575194480c176154799d6903c1"},
    {"actionId": "environment-checkpoint", "family": "runner-environment", "operation": "readEnvironmentCheckpoint", "fixtureId": null, "operationId": "environment-checkpoint", "expectedEvidenceDigest": "sha256:630b8e43fd9cf31a59c01eb5679ada60d91e5815c9ce49c34d612f8d8733a7a6"},
    {"actionId": "workspace-checkpoint", "family": "workspace-driver", "operation": "readCheckpoint", "fixtureId": null, "operationId": "workspace-checkpoint", "expectedEvidenceDigest": "sha256:aba10b577f45cdd059f21e38ac2dc27209216c26d7f2d087b58413a631dca804"},
    {"actionId": "evidence-checkpoint", "family": "checkpoint", "channel": "runner-environment", "checkpointId": "final-environment", "expectedEvidenceDigest": "sha256:d678a4468514eb96c3409669092a9d64a8c9a27470f27beb0afc53acd5965f85"},
    {"actionId": "compatibility-screenshot", "family": "screenshot", "screenshotId": "phase-1.5-compatibility"},
    {"actionId": "regression-home-new-drawing", "family": "protected-regression", "group": "home-new-drawing"},
    {"actionId": "regression-home-new-stick", "family": "protected-regression", "group": "home-new-stick"},
    {"actionId": "regression-stick-creator-back", "family": "protected-regression", "group": "stick-creator-back"},
    {"actionId": "regression-drawing-generate", "family": "protected-regression", "group": "drawing-generate-frames"},
    {"actionId": "regression-drawing-controls", "family": "protected-regression", "group": "drawing-undo-redo-play-pause"},
    {"actionId": "environment-clear", "family": "runner-environment", "operation": "clearEnvironmentPlan", "fixtureId": null, "operationId": "environment-clear", "expectedEvidenceDigest": "sha256:63c9b21a9f493552ed2c8ef517ab1f27bcdc6d7ac813e82e2004f9ed42ecd084"}
  ]
}
