{
  "registryVersion": 2,
  "specId": "SPEC-0001",
  "authorizationId": "phase-2/v1",
  "operationFamilies": [
    "checkpoint",
    "fixture",
    "pointer",
    "protected-regression",
    "runner-environment",
    "screenshot",
    "visible-role",
    "visible-testid",
    "workspace-driver"
  ],
  "adapter": {
    "path": "scripts/spec0001-browser/actions/phase2.ts",
    "byteLength": 1286,
    "sha256": "sha256:26333c4e3410aba4ff4a113765a39c812579e297312dc8429f3309c606430fa1"
  },
  "fixtures": [],
  "actions": [
    {"actionId": "compact-stick-stage", "family": "visible-testid", "operation": "assert-visible", "testId": "stick-stage"},
    {"actionId": "compact-fresh-frame", "family": "visible-testid", "operation": "assert-visible", "testId": "stick-frame-1"},
    {"actionId": "compact-open-tools", "family": "visible-role", "operation": "click", "role": "button", "accessibleName": "Stick Figure Tools", "input": null},
    {"actionId": "compact-creator-enabled", "family": "visible-role", "operation": "assert-enabled", "role": "button", "accessibleName": "Create New Stick Figure", "input": null},
    {"actionId": "compact-open-creator", "family": "visible-role", "operation": "click", "role": "button", "accessibleName": "Create New Stick Figure", "input": null},
    {"actionId": "compact-creator-save-disabled", "family": "visible-role", "operation": "assert-disabled", "role": "button", "accessibleName": "Save Stick Figure", "input": null},
    {"actionId": "compact-creator-back", "family": "visible-role", "operation": "click", "role": "button", "accessibleName": "Back", "input": null},
    {"actionId": "compact-returned-stage", "family": "visible-testid", "operation": "assert-visible", "testId": "stick-stage"},
    {"actionId": "desktop-stick-stage", "family": "visible-testid", "operation": "assert-visible", "testId": "stick-stage"},
    {"actionId": "desktop-fresh-frame", "family": "visible-testid", "operation": "assert-visible", "testId": "stick-frame-1"},
    {"actionId": "desktop-open-tools", "family": "visible-role", "operation": "click", "role": "button", "accessibleName": "Stick Figure Tools", "input": null},
    {"actionId": "desktop-creator-enabled", "family": "visible-role", "operation": "assert-enabled", "role": "button", "accessibleName": "Create New Stick Figure", "input": null},
    {"actionId": "desktop-open-creator", "family": "visible-role", "operation": "click", "role": "button", "accessibleName": "Create New Stick Figure", "input": null},
    {"actionId": "desktop-creator-save-disabled", "family": "visible-role", "operation": "assert-disabled", "role": "button", "accessibleName": "Save Stick Figure", "input": null},
    {"actionId": "desktop-creator-back", "family": "visible-role", "operation": "click", "role": "button", "accessibleName": "Back", "input": null},
    {"actionId": "desktop-returned-stage", "family": "visible-testid", "operation": "assert-visible", "testId": "stick-stage"},
    {"actionId": "desktop-fresh", "family": "screenshot", "screenshotId": "desktop-01-fresh-stick"},
    {"actionId": "desktop-after-creator", "family": "screenshot", "screenshotId": "desktop-02-stick-after-creator"},
    {"actionId": "compact-fresh", "family": "screenshot", "screenshotId": "compact-01-fresh-stick"},
    {"actionId": "compact-after-creator", "family": "screenshot", "screenshotId": "compact-02-stick-after-creator"},
    {"actionId": "protect-home-new-drawing", "family": "protected-regression", "group": "home-new-drawing"},
    {"actionId": "protect-home-new-stick", "family": "protected-regression", "group": "home-new-stick"},
    {"actionId": "protect-stick-creator-back", "family": "protected-regression", "group": "stick-creator-back"},
    {"actionId": "protect-drawing-generate", "family": "protected-regression", "group": "drawing-generate-frames"},
    {"actionId": "protect-drawing-history-playback", "family": "protected-regression", "group": "drawing-undo-redo-play-pause"}
  ]
}
